[
{"Id":1,"Name":"士官","Level":1,"CostMedal":0,"NeedHQLv":1,"Leadship":3,"HP":[12,15,18,21],"Score":25},
{"Id":2,"Name":"少尉","Level":2,"CostMedal":40,"NeedHQLv":1,"Leadship":4,"HP":[16,20,24,28],"Score":40},
{"Id":3,"Name":"中尉","Level":3,"CostMedal":50,"NeedHQLv":1,"Leadship":5,"HP":[20,25,30,35],"Score":50},
{"Id":4,"Name":"上尉","Level":4,"CostMedal":100,"NeedHQLv":1,"Leadship":7,"HP":[24,30,36,42],"Score":100},
{"Id":5,"Name":"少校","Level":5,"CostMedal":150,"NeedHQLv":1,"Leadship":9,"HP":[28,35,42,49],"Score":150},
{"Id":6,"Name":"中校","Level":6,"CostMedal":200,"NeedHQLv":1,"Leadship":11,"HP":[33,41,49,57],"Score":200},
{"Id":7,"Name":"上校","Level":7,"CostMedal":300,"NeedHQLv":1,"Leadship":14,"HP":[38,47,56,65],"Score":300},
{"Id":8,"Name":"少将","Level":8,"CostMedal":400,"NeedHQLv":1,"Leadship":17,"HP":[43,53,63,73],"Score":400},
{"Id":9,"Name":"中将","Level":9,"CostMedal":500,"NeedHQLv":1,"Leadship":21,"HP":[48,59,70,81],"Score":500},
{"Id":10,"Name":"上将","Level":10,"CostMedal":750,"NeedHQLv":1,"Leadship":25,"HP":[54,66,78,90],"Score":750},
{"Id":11,"Name":"元帅","Level":11,"CostMedal":1000,"NeedHQLv":1,"Leadship":30,"HP":[60,75,90,105],"Score":1000}
]